<?xml version="1.0" encoding="UTF-8"?>

<!-- Crea un XSD asociado al siguiente documento XML de forma que sea válido, cumpliendo los
siguientes requerimientos:
• El elemento teléfono será un entero y dicho elemento podrá aparecer entre 0 y 5 veces.
• El elemento dirección podrá aparecer 1 o 2 veces.
• El elemento número será un entero entre 0 y 200.
• El elemento provincia sólo podrá contener Sevilla o Huelva.
• El atributo dni es obligatorio, y será una plantilla de 8 números y una letra mayúscula.
• El elemento edad será opcional.-->

<alumnos xmlns:xsi="http://www.w3.org/2001/XMLSchema-instance"
xsi:noNamespaceSchemaLocation="Ej3.xsd">
    <alumno dni="11223344A">
        <nombre>Miguel Olivares</nombre>
        <direccion>
            <calle>Avenida de la Torre</calle>
            <numero>16</numero>
            <ciudad>Tomares</ciudad>
            <provincia>Sevilla</provincia>
        </direccion>
        <telefono>954556677</telefono>
        <edad>19</edad>
    </alumno>
    <alumno dni="22334455B">
        <nombre>Laura Jiménez</nombre>
        <direccion>
            <calle>Calle del Agua</calle>
            <numero>3</numero>
            <ciudad>Niebla</ciudad>
            <provincia>Huelva</provincia>
        </direccion>
        <direccion>
            <calle>Avenida de Andalucía</calle>
            <numero>42</numero>
            <ciudad>Sevilla</ciudad>
            <provincia>Sevilla</provincia>
        </direccion>
        <telefono>959778899</telefono>
    </alumno>
</alumnos>